,title,published,lat,lon,link_url,description,cause,acres
0,Creek Fire (Wildfire),"Thu, 03 Dec 2020 18:06:37 -06:00",37.201111111111,-119.27166666667,http://inciweb.nwcg.gov/incident/7147/, ,Unknown,379895
1,Riverside Fire (Wildfire),"Thu, 03 Dec 2020 17:48:24 -06:00",45.049166666667,-122.06222222222,http://inciweb.nwcg.gov/incident/7174/,"The Riverside Fire started September 8, 2020 and quickly spread to over 138,000 acres.  Fire recovery information & updates can be found on the Mt. Hood National Forest website: https://www.fs.usda.gov/detail/mthood/fire/?cid=fseprd835619  ",Unknown,379895
2,Dolan Fire (Wildfire),"Thu, 03 Dec 2020 15:40:38 -06:00",36.123333333333,-121.60166666667,http://inciweb.nwcg.gov/incident/7018/, The Dolan Fire will be considered contained/controlled/out when we receive sufficient,Human,138054
3,Klamath NF RX Burning 2020/2021 (Prescribed Fire),"Thu, 03 Dec 2020 15:09:37 -06:00",41.738611111111,-122.77888888889,http://inciweb.nwcg.gov/incident/7274/,"After a challenging fire season, the arrival of rain and snow has allowed Klamath National Forest firefighters to shift their focus to prescribed pile burning activities. Recent wildfires and their effects on communities have underscored the need for the continuance of fuels reduction projects. Fuels reduction not only helps to make communities more defensible during wildfires, but also improves a forest’s resiliency to wildfire.Fire managers use pile burning as one way to reduce fuels on National Forest lands. Piles may be produced as a result of logging activities where slash and tops are piled at landings for burning purposes, or may be created by hand thinning in areas where heavy equipment can’t be used to thin the forest. Pile burning is effective because it can be accomplished during wet or snowy conditions, allowing a long window of time for burning opportunities. It also is effective at reducing fuels in overly dense stands that could burn too intensely using...",Unknown,379895
4,Rattlesnake Fire (Wildfire),"Thu, 03 Dec 2020 13:31:38 -06:00",36.419722222222,-118.44833333333,http://inciweb.nwcg.gov/incident/7131/,"The Rattlesnake Fire was discovered on August 16 after substantial lightning occurred over the area. It started within the Sequoia and Kings Canyon Wilderness in the Kern River drainage and is now only actively burning just into the Inyo National Forest, east of the Kern River Ranger Station. The fire is burning in steep inaccessible terrain with sparse ground fuels and pockets of dead and down trees. While the size of the fire has increased, there are no current threats to life or property.  In coordination, Sequoia & Kings Canyon National Parks and Inyo National Forest, are using a confine and contain full-suppression strategy utilizing natural rock features, existing trails, and other natural barriers as containment lines. Not only does this limit exposure to firefighters and minimizes impacts in the wilderness, it allows firefighting resources to be available to battle other wildfires across the area and state that have a greater threat to life and property.   Following the first...",Human,138054
5,Cameron Peak Fire (Wildfire),"Thu, 03 Dec 2020 13:00:37 -06:00",40.608611111111,-105.87916666667,http://inciweb.nwcg.gov/incident/6964/,The Southern Area Gold Type 2 Incident Management Team assumed command of the Cameron Peak Fire on November 22nd at 6:00 pm. The Cameron Peak fire ignited on August 13 on the Arapaho and Roosevelt National Forests near Cameron Pass and Chambers Lake. The East Thompson Zone Fire started on October 22 when the East Troublesome Fire spotted across the Continental Divide and became established in Rocky Mountain National Park between the Divide and Estes Park.  The fires burned in heavy timber stands over rugged terrain. High winds combined with critically dry fuels drove fire growth. Cooler temperatures and widespread snow over the area has been dampening fire activity. There are no evacuations in place at this,Unknown,124924
6,2020-21 Royal Gorge FO Pile Burns (Prescribed Fire),"Thu, 03 Dec 2020 10:39:27 -06:00",38.444722222222,-105.19638888889,http://inciweb.nwcg.gov/incident/7266/,"November 12, 2020Bureau of Land Management plans fall-winter pile burns in Chaffee, Custer, and Fremont counties The Bureau of Land Management Rocky Mountain District Fire and Aviation Management Unit is preparing to conduct pile burns in nine locations this winter on Royal Gorge Field Office-managed lands in Chaffee, Fremont, and Custer counties.  The objective of the pile burns is to remove the slash left behind from timber harvests and previous fuels treatments. Timber harvests and fuels treatments remove beetle-killed timber and other fuels, reducing the risk of future catastrophic wildfires. They also help create various stages of plant succession, which is critical to the health of fire-adapted ecosystems. These burns will remove the leftover piled fuels but may burn some nearby live vegetation in in the project area, as well. The locations of these pile burn projects for winter 2020-2021 are as follows: Hole in the Rock: 2,400 hand-built piles among Ponderosa Pine, Piñon...",Unknown,379895
7,Shasta-Trinity RX Burning 2020/2021 (Prescribed Fire),"Wed, 02 Dec 2020 09:33:20 -06:00",41.371944444444,-121.97138888889,http://inciweb.nwcg.gov/incident/7268/," See the 'Announcements' and 'News' Tabs for the latest information on current prescribed burns.  As temperatures drop and the first precipitation of the season arrives, the Shasta-Trinity National Forest begins conducting its fall, winter and spring prescribed fire projects.   Pre-planned prescribed fire projects may take place at specific locations across the forest from November 2020 through June 2021. Actual project ignition will depend upon local weather and fuel conditions. Planned projects include burning piles as well as low-intensity understory burns of vegetation on the forest floor. The main goals of these projects are to reduce the severity of future wildfires and to provide added protection for communities in the wildland urban interface. In addition, prescribed burns promote a diverse and more resilient forest and improve habitat for wildlife.   “With the onset of cool temperatures and recent wet weather, our first prescribed fire projects are being planned north...",Human,138054
8,Woodhead BAER (Burned Area Emergency Response),"Tue, 01 Dec 2020 17:51:59 -06:00",44.756111111111,-116.87666666667,http://inciweb.nwcg.gov/incident/7262/,"  The Woodhead Fire burned almost 100,000 acres to date and is now 100% contained. The burned area is located east of Council, Idaho including lands in the Payette National Forest. Starting September 28, a team of Forest Service specialists conducted field assessments to determine the need for burned area emergency response (BAER) treatments. Specialists included hydrology, soils, engineering, botany, range, recreation, fisheries, archeology, and wildlife. BAER is a specific effort to reduce further damage due to the land being temporarily exposed in a fragile condition. Loss of vegetation exposes soil to erosion; water runoff may increase and cause flooding; sediment may move downstream and damage houses or fill reservoirs, putting habitat and community water supplies at risk. The BAER program is designed to address these situations through the key goals of protecting life, property, water quality, and deteriorated ecosystems.  Led by West Zone Hydrologist Melanie Vining, the...",Unknown,124924
9,Big Hollow Fire (Wildfire),"Tue, 01 Dec 2020 13:44:54 -06:00",45.926944444444,-121.98,http://inciweb.nwcg.gov/incident/7171/," The Big Hollow Fire is now considered to be 70% contained.   Due to the rugged remoteness of the area where much of the fire is burning total containment is not likely to occur until the snow flies or a season ending weather event occurs.  Limited smoldering and creeping may continue, but the fire is not expected to move beyond its current footprint as humidity levels remain high.  An area closure remains in effect.  There are currently no personal use restriction in place.    On Sat., Oct. 10th the Type IV Team assigned to the fire passed incident command back to the Mt. Adams Ranger District.  All resources have  been demobilized and all contractors have removed their equipment from the fire.  A Burn Area Emergency Response Team submitted an emergency rehabilitation and restoration plan on 10/13/2020.  Fall repair needs are almost accomplished and the rest will be tackled in the Spring.  The Duty Officers and Forest Incident Commanders are aware of the remaining needs....",Prescribed Fire,n/a
10,East Troublesome Post-Fire BAER (Burned Area Emergency Response),"Tue, 01 Dec 2020 10:45:30 -06:00",40.25,-105.9,http://inciweb.nwcg.gov/incident/7267/,"THREE PHASES OF WILDFIRE RECOVERYThere are three phases of recovery following wildfires on federal lands: Fire Suppression Repair is a series of immediate post-fire actions taken to repair damages and minimize potential soil erosion and impacts resulting from fire suppression activities and usually begins before the fire is contained, and before the demobilization of an Incident Management Team. This work repairs the hand and dozer fire lines, roads, trails, staging areas, safety zones, and drop points used during fire suppression efforts.Emergency Stabilization-Burned Area Emergency Response (BAER) is a rapid assessment of burned watersheds by a BAER team to identify imminent post-wildfire threats to human life and safety, property, and critical natural or cultural resources on National Forest System lands and take immediate actions to implement emergency stabilization measures before the first post-fire damaging events. Fires result in loss of vegetation, exposure of soil to...",Unknown,379895
11,East Troublesome Fire (Wildfire),"Tue, 01 Dec 2020 10:43:57 -06:00",40.200555555556,-106.23416666667,http://inciweb.nwcg.gov/incident/7242/,"The East Troublesome Fire was reported on the afternoon of October 14. The origination point was northeast of Kremmling in Grand County, Colo. on the Arapaho National Forest. The cause is still under investigation. Within three days, high winds and low humidity allowed the fire to spread to over 10,000 acres. The direction of fire spread threatened State Highway 125 and forced the closure of the road and mandatory evacuation of approximately 90 homes by October 17.Between Oct. 20-23, the fire spread increased dramatically with 24-hour increases of around 18,000 to 87,000 acres during the four-day run. The peak fire spread of 87,093 acres occurred between late afternoon on Oct. 21 and the early afternoon of Oct. 22. The size of the fire exploded from 18,550 acres to 187,964 acres during this period. The fire crossed Highway 125 on the afternoon of Oct. 21 and spread eastward into the Rocky Mountain National Park on Oct. 22, crossing the Continental Divide and reaching the western edge...",Human,138054
12,Williams Fork Fire (Wildfire),"Tue, 01 Dec 2020 10:37:42 -06:00",39.851111111111,-106.06472222222,http://inciweb.nwcg.gov/incident/6971/,"The Williams Fork Fire was first reported on Aug. 14 at approximately noon and the cause is still under investigation. The origination point was 15 miles southwest of Fraser, Colo. in the Arapaho National Forest. The fire grew in size to 6,122 acres by the end of August 16th, and became a threat to the communities of Fraser and Winter Park.The fuels consisted of heavy dead and down beetle killed lodgepole pine and during the first week low relativity humidity of around 10 to 30 percent contributed to fire growth and behavior. After the initial three-day fire growth, the peak fire spread occurred on Aug. 20 reached 1,977 acres with a total size of 9,444.Over the next two months, the daily fire spread was limited to between 1 and 561 acres and the fire reached it’s current size of 14,833 acres on October 27th and was declared controlled after an infrared flight Nov. 30 detected no remaining heat in the fire area.",Unknown,124924
13,SQF Complex (Wildfire),"Tue, 01 Dec 2020 07:35:02 -06:00",36.255,-118.49666666667,http://inciweb.nwcg.gov/incident/7048/,"Operations Map |  Fire History Map |   Land Ownership Map   |  Fire Progression Map   |   Facebook            Fire personnel in the Sequoia National Forest and Sequoia and Kings Canyon National Parks are now managing the 174,178-acre SQF Complex. This lightning-caused Castle and Shotgun Fires were discovered on August 19, 2020, and later managed as one incident named the SQF Complex. The Castle Fire burned on portions of the Sequoia National Forest and Giant Sequoia National Monument (129,975 acres), Inyo National Forest (12,283 acres), Sequoia National Park (18,292 acres), lands managed by the Bureau of Land Management (728 acres), State (4,036 acres), County, and private lands (4,726 acres) and threatened the Tule River Indian Reservation.   Containment of the SQF Complex has increased to 90% for the portion of the fire managed by the Sequoia National Forest. Due to limited access to the fires edge in remote locations, full containment is not expected...",Prescribed Fire,n/a
14,Fall Prescribed Fire Projects 2020 (Prescribed Fire),"Mon, 30 Nov 2020 14:20:28 -06:00",44.417777777778,-118.95138888889,http://inciweb.nwcg.gov/incident/7216/," Please take a moment to look at the links section of this page to see information on Smoke as well as to access  USFS R6 Tri-Forest Prescribed Fire Projects   Burning has begun at: Emigrant Creek Ranger District  will continue burning of landing and grapple piles in the Upper Pine National Forest System Road 28 areas.   Prairie City- burning piles in the Summit Prairie area today and may  be the next few days.  May move to landing piles near Logan valley if able to gain access and have the personnel.  Burning in the Elk 16 project is done for the year  unless the weather drastically changes  Blue Mountain Ranger District- currently no burning planned.      Burning may take place at: Starr units 31, 32, 33 Approx. 1435 acres. South side of the National Forest System (NFS) road 24 and north of the NFS road 2400071, 9 miles west of Seneca. T16S, R30E, sec 29, 30 & T16S, R29E, sec 24,25Starr units 6, 7, approx. 400 acres south of the NFS road 4920333 west of Highway (Hwy)...",Lightning,8177
15,Slater/Devil Fires (Wildfire),"Sat, 28 Nov 2020 14:40:10 -06:00",41.766111111111,-123.375,http://inciweb.nwcg.gov/incident/7173/,"    Please visit our incident's Facebook page for updates throughout the day at: https://www.facebook.com/SlaterAndDevilFireInformation   The Slater Fire started on September 8, near Slater Butte Fire Lookout on the Klamath National Forest. It is currently burning on the Klamath, Six Rivers, and Rogue-Siskiyou National Forests in Siskiyou and Del Norte Counties in California and Josephine County in Oregon. Road closure and evacuations are in place due to the Slater Fire. The Devil Fire, which was detected on September 9, 2020, is located north of Upper Devil's Peak on the Klamath National Forest.    For Specific Evacuation Information contact: Anyone interested in accessing their home or property should contact the local sheriff’s office. Siskiyou County information: (530) 841-2900 or www.facebook.com/SiskiyouCountySheriff/ Del Norte County information: (707) 464-7213 or www.facebook.com/DelNorteOfficeOfEmergencyServices  and www.preparedelnorte.com/  Closures: The Klamath,...",Unknown,379895
16,North Complex (Wildfire),"Wed, 25 Nov 2020 11:56:38 -06:00",40.090833333333,-120.93111111111,http://inciweb.nwcg.gov/incident/6997/," The incident command post (ICP) for North Complex (Claremont-Bear Fire) operations has shifted from Quincy to Oroville, CA, as higher elevation areas become less accessible for suppression repair and hazard tree removal.  The fire is expected to be 98% contained within a day or so with full containment a week or two off, weather & operations dependent; there is significant heat remaining in lower elevation areas not covered by snow.  Plumas National Forest officials have sharply reduced the closure area which now follows (generally) the actual fire perimeter and affects all national forest land, roads and trails with the fire closure area.  County roads and private land within the perimeter are not affected by the federal land closure. For more information about the closure, please check the forest website at: https://www.fs.usda.gov/alerts/plumas/alerts-notices . Within the closure area, Forest Service trails, roads, and campgrounds are closed. Falling trees (often falling without...",Human,138054
17,Mountain View Fire (Wildfire),"Wed, 25 Nov 2020 10:34:07 -06:00",38.515,-119.46527777778,http://inciweb.nwcg.gov/incident/7270/,"The Mountain View fire is 70% contained at 20,385 acres.  Containment line has been secured around 70% of the fire perimeter; the remaining 30% is under snow.  Fire activity is minimal and confined to “ground fire”.  This means that stumpholes and underground roots are the only fuels actively burning.  Snow melt is aiding in extinguishing these materials.  Generally there are not enough surface fuels to support fire spread.  The remaining visible smokes are from individual burning pinyon trees well within the secured fire perimeter.California Fire Management Team 11 will return management of the Mountain View fire to the hosting agencies:  Bureau of Land Management, the Humboldt-Toiyabe National Forest and Antelope Valley Fire Department today at 8 PM.  Mountain View firefighters will return home tomorrow.Evacuations were lifted yesterday morning for remaining Antelope Valley residents.  Mono County will be updating the following website with recovery resources available...",Unknown,124924
18,Laura 2 Fire (Wildfire),"Tue, 24 Nov 2020 16:31:07 -06:00",40.334166666667,-120.115,http://inciweb.nwcg.gov/incident/7269/,"The fire is fully contained, and the Fort Sage OHV Area has reopened.  This fire started in the Lassen County community of Doyle on Tuesday, Nov. 17.  It destroyed 21 homes and 19 outbuildings.  It burned a total of 2,800 acres, including public lands and developments in the Bureau of Land Management Fort Sage Off Highway Vehicle Recreation Area.  This is the final update for the Laura 2",Prescribed Fire,n/a
19,Grouse Fire (Wildfire),"Tue, 24 Nov 2020 12:49:19 -06:00",43.540555555556,-115.17277777778,http://inciweb.nwcg.gov/incident/7154/," The Grouse Fire started Sept. 6, 2020, about 7:30 p.m. The fire’s ignition location was along the boundary of the Boise and Sawtooth National Forests about 6 miles northeast of Pine, Idaho, in the area of National Forest System (NFS) roads 166 and 166e. Campers were evacuated from the area of the closure. September 21 - This will be the final update unless significant fire activity occurs.The Grouse fire is currently 3,980 acres. The fire crossed into the Sawtooth National Forest and both forests are coordinating on the management of the fire. For public health and safety, a multi-forest closure is in place for the entire fire area. The Incident Commander and all firefighting personnel appreciate the public’s cooperation in staying out of the forest closure area and the Incident Command Post. The local unit will manage the fire.   Objectives: An area closure is in place, including a number of trails and roads. Bulldozers  and handcrews continue to put in line where...",Lightning,8177
20,Middle Fork Fire (Wildfire),"Mon, 23 Nov 2020 17:35:42 -06:00",40.627777777778,-106.79444444444,http://inciweb.nwcg.gov/incident/7153/,"Middle Fork Fact Sheet - 11/02/2020, 2:30 p.m.        Acres: 20,433          Containment: 60%Minimal Fire Behavior with Snow Cover ContinuesRecon flights over the weekend showed no growth. Acreage and containment remain current; most heat remains in the northeast corner of the fire. Most of this isolated heat source is on a north-facing slope and remains covered by snow with minimal sun exposure. Currently 3 engines, 1 squad, and one Type 3 helicopter are assigned to the fire. Many roads and trails approaching the fire are still covered in snow and no ground crews have been able to access the perimeter. Fire behavior continues to be minimal. Area, road and trail closures remain in",Unknown,208913
21,Moraine Fire (Wildfire),"Sun, 22 Nov 2020 18:09:42 -06:00",36.717777777778,-118.55722222222,http://inciweb.nwcg.gov/incident/7089/,"     The Moraine Fire was discovered on August 21 after substantial lightning occurred over the area. It is located within the Sequoia - Kings Canyon Wilderness, southeast of Cedar Grove, Kings Canyon National Park. There is no threat to life or property at this time.   Due to limited firefighting resources and the fire burning in designated wilderness, the fire is being monitored via air. However, fire managers are prepared to send firefighters in if the activity warrants and direct suppression action.  Fire managers continue to use a confine and contain strategy with natural and human-made features to respond to the Moraine Fire. Following the winter storm from November 7 & 8, fire managers continue to conduct helicopter observation missions over the Moraine Fire. Like many of the fires in the Sierra Nevada following this storm, much of the energy was taken out of the fire. However, there was noticeable snow melt by mid-week. A few isolated pockets of heat remain but there...",Unknown,379895
22,Ridge Fire (Wildfire),"Fri, 20 Nov 2020 12:11:03 -06:00",35.007777777778,-113.87861111111,http://inciweb.nwcg.gov/incident/6990/,"NO FURTHER FIRE UPDATES - AREA CLOSURE IS ACTIVE Past Daily Updates/News Releases -INCIDENT SUMMARY-The Ridge Fire located in the Hualapai Mountains, southeast of Kingman, AZ. It started the afternoon of August 16 as the result of a lightning strike from area thunderstorms. The community of Pine Lake is approximately 5 miles north of the fire. As of 9/2/2020 the fire was 100% contained.There are NO threats to homes or structures from the Ridge Fire.  Area residents should always be READY.Closures: On August 26 at 0700, the BLM partially rescinded the Fire Closure Order previously put in place on August 21.  CLOSURE ORDER & MAPThere may be short term access restrictions on BLM Road 7101, also known as Flag Mine Road and Antelope Wash Road as fire crews continue masticating vegetation along those roadways.  County Emergency Notification System: Mohave County residents are encouraged to sign up for the County's Code Red Emergency Notification...",Human,138054
23,Cameron Peak Post-Fire BAER (Burned Area Emergency Response),"Fri, 20 Nov 2020 11:53:51 -06:00",40.608611111111,-105.7625,http://inciweb.nwcg.gov/incident/7210/,"A BAER team conducted a preliminary assessment when the Cameron Peak Fire was approximately 99,000 acres in September. Due to its continued growth, another round of BAER was necessary. This second round began Nov. 9. Results from this BAER team are not expected until after Thanksgiving sometime and will be posted here when available.THREE PHASES OF WILDFIRE RECOVERY   There are three phases of recovery following wildfires on federal lands:      Fire Suppression Repair is a series of immediate post-fire actions taken to repair damages and minimize potential soil erosion and impacts resulting from fire suppression activities and usually begins before the fire is contained, and before the demobilization of an Incident Management Team. This work repairs the hand and dozer fire lines, roads, trails, staging areas, safety zones, and drop points used during fire suppression efforts.     Emergency Stabilization-Burned Area Emergency Response (BAER) is a rapid assessment of burned...",Unknown,124924
24,SQF Complex Post-Fire BAER (Burned Area Emergency Response),"Thu, 19 Nov 2020 18:00:04 -06:00",36.169444444444,-118.32722222222,http://inciweb.nwcg.gov/incident/7240/,"  THREE PHASES OF WILDFIRE RECOVERY       There are three phases of recovery following wildfires on federal lands:       Fire Suppression Repair     Emergency Stabilization-Burned Area Emergency Response (BAER)     Long-Term Recovery and Restoration         Fire Suppression Repair is a series of immediate post-fire actions taken to repair damages and minimize potential soil erosion and impacts resulting from fire suppression activities and usually begins before the fire is contained, and before the demobilization of an Incident Management Team. This work repairs the hand and dozer fire lines, roads, trails, staging areas, safety zones, and drop points used during fire suppression efforts.     Emergency Stabilization-Burned Area Emergency Response (BAER) is a rapid assessment of burned watersheds by a BAER team to identify imminent post-wildfire threats to human life and safety, property, and critical natural or cultural resources on National Forest System lands and take immediate...",Prescribed Fire,n/a
