,title,published,lat,lon,link_url,description,cause,acres
25,Mullen Fire (Wildfire),"Thu, 19 Nov 2020 11:12:44 -06:00",41.176388888889,-106.42194444444,http://inciweb.nwcg.gov/incident/7208/,"The Mullen Fire is burning in the Medicine Bow National Forest (MBF), southwest of Centennial, Wyoming. The fire was reported in the Savage Run Wilderness on Thursday, September 17, and spread rapidly in extremely rugged terrain, with dense vegetation and beetle-killed deadfall. The fire continues to burn and has damaged 66 structures. The cause of the fire remains under investigation. Firefighting priorities are public and firefighter safety, the protection of structures and community infrastructure.  Values at risk include multiple communities in the surrounding area and the Rob Roy Reservoir.  Rob Roy Reservoir is the water source for the city of Cheyenne. Regional wildfire resources responded and began fire suppression on the wildfire when it was reported on September 17. The fire continued to grow in complexity requiring elevated incident management. The Rocky Mountain Incident Management Blue Team took command of the fire on September 22. The Southern Area Incident Management...",Lightning,8177
26,Snow (Wildfire),"Wed, 18 Nov 2020 18:38:51 -06:00",33.888888888889,-116.685,http://inciweb.nwcg.gov/incident/7207/,"  Steep rugged terrain San Jacinto Wilderness  On November 16, 2020 San Bernardino National Forest officials announced that the Snow Fire, along with the El Dorado and Apple Fires have reached 100% containment. These fires were previously at 95% containment because uncontained perimeters were located in steep and inaccessible terrain. Containment has now been achieved as fire in uncontained areas has reached natural features void of vegetation.Although full containment has been reached, the three fires remain in a status called uncontrolled. That means smoldering continues within the interior of the burn scar perimeters.Fire restrictions on the forest will remain in effect until conditions improve, and are listed on the San Bernardino National Forest webpage.Portions of the San Jacinto Wilderness, Santa Rosa and San Jacinto National Monument, Tahquitz National Game Preserve as well as portions of the Pacific Crest Trail are within the fire perimeter.  Please visit the forest's...",Unknown,208913
27,Apple Fire (Wildfire),"Wed, 18 Nov 2020 18:30:04 -06:00",33.998333333333,-116.93333333333,http://inciweb.nwcg.gov/incident/6902/,"On November 16, 2020 San Bernardino National Forest officials announced that the Apple Fire, along with the El Dorado and Snow Fires have reached 100% containment. These fires were previously at 95% containment because uncontained perimeters were located in steep and inaccessible terrain. Containment has now been achieved as fire in uncontained areas has reached natural features void of vegetation.Although full containment has been reached, the three fires remain in a status called uncontrolled. That means smoldering continues within the interior of the burn scar perimeters.""We're pleased to see this improvement, but we remain cautious,"" said Deputy Fire Chief Scott Howes. ""We've experienced below normal precipitation and several heat waves over the last six months. Temperatures continue to be high, the vegetation is drying out again and there is no new precipitation in sight.""Fire restrictions on the forest will remain in effect until conditions improve. Campfires, dispersed camping,...",Prescribed Fire,n/a
28,Bell Fire (Wildfire),"Wed, 18 Nov 2020 18:03:46 -06:00",38.183055555556,-119.86861111111,http://inciweb.nwcg.gov/incident/6915/,"The Bell Fire is located in a remote area of the Stanislaus National Forest (STF) on the Summit Ranger District in the Emigrant Wilderness between the 8000 to 9000 ft level. The fire has remained at 50 acres over the last few weeks and is mostly burning inside control lines among a large rocky area with sparse fuels. This fire is located about five miles east of Dodge Ridge Ski Resort, 1.5 miles southeast of Gianelli Trailhead, and 2 miles east of Crabtree Trailhead (as a bird flies), and about a half mile north of Bear Lake. The fire burned north beyond a short section of the Lake Valley (#19E21) trail. See Map link above. Safety is our highest priority, and helping prevent additional wildfires and the spread of COVID-19 among our fire fighters and within the communities we serve is an important part of our focus on safety this year. The STF Incident Management Team is utilizing a confine and contain suppression strategy on the Bell Fire for firefighter and public safety, while...",Unknown,379895
29,El Dorado Fire (Wildfire),"Wed, 18 Nov 2020 16:49:47 -06:00",34.052777777778,-116.99222222222,http://inciweb.nwcg.gov/incident/7148/,"  On November 16, 2020 San Bernardino National Forest officials announced that the El Dorado Fire, along with the Apple and Snow Fires have reached 100% containment. These fires were previously at 95% containment because uncontained perimeters were located in steep and inaccessible terrain. Containment has now been achieved as fire in uncontained areas has reached natural features void of vegetation.Although full containment has been reached, the three fires remain in a status called uncontrolled. That means smoldering continues within the interior of the burn scar perimeters. As an illustration of that, smoke continued to be seen from the El Dorado Fire in the Forest Falls, Calif., community during the second week of November after a winter storm brought several inches of snow.Evacuation warnings were lifted on Wednesday, November 11 at 8:50 AM by the San Bernardino County Sheriff for the communities of Mountain Home Village, Forest Falls, Angelus Oaks, Seven Oaks, and Barton...",Human,138054
30,Slater/Devil Post-Fire BAER (Burned Area Emergency Response),"Tue, 17 Nov 2020 14:18:58 -06:00",41.85,-123.51388888889,http://inciweb.nwcg.gov/incident/7237/,"THREE PHASES OF WILDFIRE RECOVERY   There are three phases of recovery following wildfires on federal lands:      Fire Suppression Repair     Emergency Stabilization-Burned Area Emergency Response (BAER)     Long-Term Recovery and Restoration        Fire Suppression Repair is a series of immediate post-fire actions taken to repair damages and minimize potential soil erosion and impacts resulting from fire suppression activities and usually begins before the fire is contained, and before the demobilization of an Incident Management Team. This work repairs the hand and dozer fire lines, roads, trails, staging areas, safety zones, and drop points used during fire suppression efforts.     Emergency Stabilization-Burned Area Emergency Response (BAER) is a rapid assessment of burned watersheds by a BAER team to identify imminent post-wildfire threats to human life and safety, property, and critical natural or cultural resources on National Forest System lands and take immediate actions to...",Unknown,124924
31,Archie Creek Fire (Wildfire),"Tue, 17 Nov 2020 12:59:53 -06:00",43.333888888889,-122.78805555556,http://inciweb.nwcg.gov/incident/7176/,"  The Archie Creek Fire is located east of Roseburg in the North Umpqua corridor on state, private and federal land.    The Thielsen Fire is located on the Umpqua National Forest near Diamond Lake. There will be continue to be some smoke visible from smoldering stumps and logs within the fire perimeter until these are extinguished by winter rains.   Motorists are advised to monitor https://www.tripcheck.com/ for updates on the highway closure.   For information on area closures on BLM managed lands and the Umpqua National Forest, click on the Closure tab at the top of the",Prescribed Fire,n/a
32,Calwood Fire (Wildfire),"Sat, 14 Nov 2020 17:45:20 -06:00",40.153611111111,-105.38166666667,http://inciweb.nwcg.gov/incident/7245/," 11/14/2020 Update:The #CalWoodFire was contained today at 11:30 AM. The fire was again tested by high winds today and showed no signs of heat or smoke. Firefighters will continue to check the fire daily. This will be the last update unless something significant happens. 11/13/2020 Update:The #CalWoodFire remains 85 percent contained. Today, the fire was tested by winds but showed no signs of smoke or heat. Additionally, the MMA flight detected no heat sources in the fire area. Boulder County Communications Center continued to receive multiple phone calls about smoke columns. This was confirmed to be snow, ash and dust blowing in the wind by firefighters patrolling the fire. Please rest assured, firefighters will continue to closely monitor and patrol the fire for any sources of heat or smoke. Higher winds are expected tomorrow in the 60 mph range with gusts up to 80 mph. A storm this weekend is expected to bring more snow to the fire area.11/12/2020 Update: The #CalWoodFire remains...",Lightning,8177
33,Bullfrog Fire (Wildfire),"Sat, 14 Nov 2020 16:00:37 -06:00",37.141111111111,-119.02527777778,http://inciweb.nwcg.gov/incident/7191/,"The Bullfrog is located forty-three miles northeast of Clovis, CA., on the eastern fringe of the Dinkey Lakes Wilderness west of Courtright Reservoir. This fire is not related to the Creek Fire, it is a separate start discovered on September 09, 2020 at approximately 3:09 PM. It is being managed by the Sierra National Forest using a confine and contain strategy taking advantage of  trails, natural features, and hand crews to fully suppress this fire. The Bullfrog Fire has burned 1185 acres and is 60% contained. Crews remain on scene to continue to monitor the suppression lines on the east side of the fire and to strengthen, and improve control lines as needed. The west side of the fire will be allowed to burn until it reaches natural barriers keeping the fire contained. There is no threat to life or property.The fire will remain at 60% containment until a season ending event occurs (rain/snow). The west side of the fire does not have a containment line instead the IC...",Unknown,208913
34,Creek Post-Fire BAER (Burned Area Emergency Response),"Sat, 14 Nov 2020 15:58:01 -06:00",37.1,-119.16666666667,http://inciweb.nwcg.gov/incident/7221/,"  THREE PHASES OF WILDFIRE RECOVERY       There are three phases of recovery following wildfires on federal lands:       Fire Suppression Repair     Emergency Stabilization-Burned Area Emergency Response (BAER)     Long-Term Recovery and Restoration         Fire Suppression Repair is a series of immediate post-fire actions taken to repair damages and minimize potential soil erosion and impacts resulting from fire suppression activities and usually begins before the fire is contained, and before the demobilization of an Incident Management Team. This work repairs the hand and dozer fire lines, roads, trails, staging areas, safety zones, and drop points used during fire suppression efforts.     Emergency Stabilization-Burned Area Emergency Response (BAER) is a rapid assessment of burned watersheds by a BAER team to identify imminent post-wildfire threats to human life and safety, property, and critical natural or cultural resources on National Forest System lands and take immediate...",Prescribed Fire,n/a
35,White River (Wildfire),"Fri, 13 Nov 2020 12:56:22 -06:00",45.181388888889,-121.57555555556,http://inciweb.nwcg.gov/incident/7013/,"The White River Fire is located in Wasco County, Oregon and back under the management of the Mt. Hood National Forest.  As of 11/13/2020 this fire is in patrol status. Forest Closure: To ensure public and firefighter safety, areas of the Mt. Hood National Forest within the fire perimeter are closed. Visit www.fs.usda.gov/alerts/mthood/alerts-notices for more information about the closure.  For the current smoke outlook and air quality information, visit: https://fires.airfire.org/outlooks/columbia_river_gorge_or_wa",Prescribed Fire,n/a
36,San Juan NF Prescribed Fire Program (Prescribed Fire),"Thu, 12 Nov 2020 15:12:20 -06:00",37.278888888889,-107.88222222222,http://inciweb.nwcg.gov/incident/6288/,"  The San Juan National Forest Fuels Management Staff are planning to burn slash piles this fall and winter. Operations typically take place after significant weather such as when snowfall occurs. These piles consist of thinning slash from hazardous fuels reduction projects and timber sales. Hazardous fuels reduction projects target specific areas to reduce wildfire hazards to nearby private residences, land, and other infrastructure.  Operations will begin as early as this month and could continue through April, when sufficient weather and snow is present to prevent fire spread and will continue as long as conditions allow. Firefighters will ignite and closely monitor pile burning activities. Burning will only occur when all conditions of the state issued smoke permit are met. These activities should not affect public access or use of the forest. The Columbine Ranger District plans to burn slash piles in areas east of Bayfield in Saul’s Creek near Forest System Road (FSR) 608 and...",Unknown,379895
37,August Complex (Wildfire),"Thu, 12 Nov 2020 14:24:25 -06:00",39.659444444444,-122.80888888889,http://inciweb.nwcg.gov/incident/6983/," The August Complex is 1,032,648 acres and 100% contained. The fires within the Complex ignited August 16 and 17, 2020.  Management of the incident has been transferred back to the local units. Coordination continues between the Mendocino, Six Rivers and Shasta-Trinity national forests.    Shasta-Trinity National Forest Closure: |Closure Map  Mendocino National Forest Closure: |Closure Map  Six Rivers National Forest Closure:|Closure Map   ",Human,138054
38,Kootenai Fuels Prescribed Fire (Prescribed Fire),"Thu, 12 Nov 2020 10:28:22 -06:00",47.713055555556,-116.72916666667,http://inciweb.nwcg.gov/incident/7258/," English Point and Canfield Mountain Pile Burning  The Coeur d’Alene River Ranger District of the Idaho Panhandle National Forests will be burning piles associated with the Kootenai Fuel Reduction Project. Interagency crews will be working to burn slash piles on Canfield Mountain and English Point from over 600 acres of pruning, thinning, and brushing work completed earlier this year. There are other smaller prescribed fire units north Rose Lake, and along the southeast side of Hayden Lake. Hazardous fuels reduction in the Wildland-Urban Interface (WUI) comprises National Forest System lands adjacent to private property and the protection of emergency services communication infrastructure on Canfield Butte.  Hunters: if you see piles in the area, know that your hunt may be inadvertently disturbed by prescribed fire activity. This burning activity should have minimal, localized smoke impacts, and will not interfere with travel on-Forest. Smoke will be highly visible from Coeur...",Unknown,124924
39,Bryan Mountain Fire (Wildfire),"Tue, 10 Nov 2020 13:29:10 -06:00",45.267777777778,-116.46472222222,http://inciweb.nwcg.gov/incident/7227/,"The Bryan Mountain fire was detected the afternoon of October 1, 2020 between the West Fork and the main Rapid River, approximately six miles southeast of Pollock. The Bryan Mountain fire has been officially declared",Prescribed Fire,n/a
40,Fork Fire (Wildfire),"Mon, 09 Nov 2020 14:40:43 -06:00",38.990277777778,-120.39416666667,http://inciweb.nwcg.gov/incident/7165/,"  A Type 5 organization is managing the Fork Fire. The Fork Fire is 1673 Acres with 100% containment. Fire activity has been minimal, however windblown needle cast over the completed fire lines and strong winds resulted in a 2.6-acre slop over on 10/27 which was contained at 97 acres. The Fork Fire started in the Crystal Basin near Gerle Creek under critical fire weather conditions. Driven by east winds gusting 30-50 miles per hour, the fire grew rapidly to the west. It is burning in the Rubicon River drainage and the 2014 King Fire burn scar. The Rubicon canyon is in an extremely steep and remote area which makes firefighting difficult. This area of the King Fire had burned at high severity with nearly 100% tree mortality, leaving large snag patches of fire killed trees. The standing snags are a significant safety hazard, especially in strong winds. There is also a high concentration of dead and down trees creating a heavy fuel load, as well as dense post-fire regrowth of 4-6 foot...",Lightning,8177
41,Point Fire (Wildfire),"Mon, 09 Nov 2020 14:20:03 -06:00",39.003055555556,-120.48222222222,http://inciweb.nwcg.gov/incident/7254/," The Point Fire remains at 93 acres with 97% Containment. Containment lines continue to hold as fire personnel continue with mop up and control any hot spots that are still smoldering and burning as it is safe to do so. There are still many standing snags creating hazard conditions for fire personnel still assigned to the incident. Rehab and repair for the Point Fire is to be completed on mechanically created fire lines. This is done using a dozer or excavator to pull the soils back to restore original landscape and by using brush, limbs, poles, and logs placing them into naturally appearing arrangements. The Objectives remain the same to provide for fire fighter safety & to protect private and public lands.  The Point Fire began On October 26 at 6:00 AM off Nevada Point Rd and Long Creek Rd, north of Ellicott Bridge in the Georgetown RD of the Eldorado National Forest. Eldorado NF and Cal Fire resources responded to the incident. It is located within the 2014 King Fire Footprint...",Unknown,208913
42,Woodhead Fire (Wildfire),"Fri, 06 Nov 2020 14:39:45 -06:00",44.756111111111,-116.87666666667,http://inciweb.nwcg.gov/incident/7163/," The Woodhead Fire is contained and is in patrol status.  Suppression rehab is completed with the expectation of winter weather conditions in the near future. Over 60 miles of dozer line was repaired across private, state, Bureau of Land Management, and Forest Service lands. It took a lot of coordination with other agencies, landowners, and permittees to perform the repair work. The fire personnel and resource advisor were able to complete the repair with the help of three excavators, one dozer, and the Black Mountain Hot Shot crew. This work concludes the Woodhead Fire incident.   The BAER assessment was also completed this week and a proposed treatment plan was submitted to the Intermountain Regional Office for review and approval. Additional details regarding the BAER treatments will be announced upon approval and a new Inciweb site will be established for the Woodhead BAER efforts.   ",Prescribed Fire,n/a
43,Red Salmon Post-Fire BAER (Burned Area Emergency Response),"Fri, 06 Nov 2020 13:01:13 -06:00",41.085,-123.31388888889,http://inciweb.nwcg.gov/incident/7253/,"  THREE PHASES OF WILDFIRE RECOVERY       There are three phases of recovery following wildfires on federal lands:       Fire Suppression Repair     Emergency Stabilization-Burned Area Emergency Response (BAER)     Long-Term Recovery and Restoration         Fire Suppression Repair is a series of immediate post-fire actions taken to repair damages and minimize potential soil erosion and impacts resulting from fire suppression activities and usually begins before the fire is contained, and before the demobilization of an Incident Management Team. This work repairs the hand and dozer fire lines, roads, trails, staging areas, safety zones, and drop points used during fire suppression efforts.     Emergency Stabilization-Burned Area Emergency Response (BAER) is a rapid assessment of burned watersheds by a BAER team to identify imminent post-wildfire threats to human life and safety, property, and critical natural or cultural resources on National Forest System lands and take immediate...",Prescribed Fire,n/a
44,Grizzly Creek Fire (Wildfire),"Fri, 06 Nov 2020 10:13:47 -06:00",39.566666666667,-107.27138888889,http://inciweb.nwcg.gov/incident/6942/," Nov. 6 Update Firefighters are continuing to monitor the Grizzly Creek Fire and are reporting occasional smokes, particularly on the recent warm afternoons. Smoke is mostly from smoldering in the timber litter, duff and some dead and down on the west side of the Grizzly Creek drainage. The fire remains in the steep, rugged terrain difficult for firefighters to access safely. The fire is not currently expected to grow from this activity.  Firefighters will continue monitoring and will evaluate the impacts of this weekend’s anticipated moisture.The fire remains 32,631 acres and 91 percent contained.Maps of the current area closure as well as the fire perimeter are available on InciWeb: inciweb.nwcg.gov/incident/6942/. Check www.blm.gov or www.fs.usda.gov/whiteriver for the latest fire restriction information.",Burned Area Emergency Response,n/a
45,Evans Canyon Fire (Wildfire),"Fri, 06 Nov 2020 00:37:48 -06:00",46.854166666667,-120.79888888889,http://inciweb.nwcg.gov/incident/7132/," The Evans Canyon Fire started on the afternoon of Aug 31, 2020 and is located in Yakima and Kittitas Counties in the Evans Canyon area.  The fire is being managed by a Type 3 Incident Management Team with the primary focus on mop-up and suppression damage repair.  All evacuation orders have been lifted and some area closures remain in effect due to the Washington State Fire Commissioners orders.  People are encouraged to check the Yakima County Emergency Management Website for more information at",Unknown,379895
46,August Complex Post-Fire BAER (Burned Area Emergency Response),"Thu, 05 Nov 2020 22:38:28 -06:00",39.59,-122.73944444444,http://inciweb.nwcg.gov/incident/7228/,"  THREE PHASES OF WILDFIRE RECOVERY       There are three phases of recovery following wildfires on federal lands:       Fire Suppression Repair     Emergency Stabilization-Burned Area Emergency Response (BAER)     Long-Term Recovery and Restoration         Fire Suppression Repair is a series of immediate post-fire actions taken to repair damages and minimize potential soil erosion and impacts resulting from fire suppression activities and usually begins before the fire is contained, and before the demobilization of an Incident Management Team. This work repairs the hand and dozer fire lines, roads, trails, staging areas, safety zones, and drop points used during fire suppression efforts.     Emergency Stabilization-Burned Area Emergency Response (BAER) is a rapid assessment of burned watersheds by a BAER team to identify imminent post-wildfire threats to human life and safety, property, and critical natural or cultural resources on National Forest System lands and take immediate...",Human,138054
47,Horse Fire (Wildfire),"Thu, 05 Nov 2020 15:17:35 -06:00",34.274722222222,-112.41888888889,http://inciweb.nwcg.gov/incident/7244/,"As of November 1, 2020. The Horse Fire is 100% contained and is currently in monitor status. ",Unknown,124924
48,Lake Post-Fire BAER (Burned Area Emergency Response),"Wed, 04 Nov 2020 23:47:08 -06:00",34.641388888889,-118.32916666667,http://inciweb.nwcg.gov/incident/7115/,"  THREE PHASES OF WILDFIRE RECOVERY          There are three phases of recovery following wildfires on federal lands:       Fire Suppression Repair     Emergency Stabilization-Burned Area Emergency Response (BAER)     Long-Term Recovery and Restoration         Fire Suppression Repair is a series of immediate post-fire actions taken to repair damages and minimize potential soil erosion and impacts resulting from fire suppression activities and usually begins before the fire is contained, and before the demobilization of an Incident Management Team. This work repairs the hand and dozer fire lines, roads, trails, staging areas, safety zones, and drop points used during fire suppression efforts.     Emergency Stabilization-Burned Area Emergency Response (BAER) is a rapid assessment of burned watersheds by a BAER team to identify imminent post-wildfire threats to human life and safety, property, and critical natural or cultural resources on National Forest System lands and take immediate...",Prescribed Fire,n/a
49,Ranch2 Post-Fire BAER (Burned Area Emergency Response),"Wed, 04 Nov 2020 23:46:53 -06:00",34.156666666667,-117.91083333333,http://inciweb.nwcg.gov/incident/7114/,"  THREE PHASES OF WILDFIRE RECOVERY          There are three phases of recovery following wildfires on federal lands:       Fire Suppression Repair     Emergency Stabilization-Burned Area Emergency Response (BAER)     Long-Term Recovery and Restoration         Fire Suppression Repair is a series of immediate post-fire actions taken to repair damages and minimize potential soil erosion and impacts resulting from fire suppression activities and usually begins before the fire is contained, and before the demobilization of an Incident Management Team. This work repairs the hand and dozer fire lines, roads, trails, staging areas, safety zones, and drop points used during fire suppression efforts.     Emergency Stabilization-Burned Area Emergency Response (BAER) is a rapid assessment of burned watersheds by a BAER team to identify imminent post-wildfire threats to human life and safety, property, and critical natural or cultural resources on National Forest System lands and take immediate...",Lightning,8177
